{
  "intentId": "5d8f2a17-6c4b-4e39-a8d1-7f3e0b9c2a64",
  "clientIntentId": "1a7c3e95-2b6d-4f08-9e4a-8c5b1d3f7e20",
  "dogIds": [
    "siberian-husky",
    "bulldog"
  ],
  "canonicalDogIds": [
    "bulldog",
    "siberian-husky"
  ],
  "state": "fulfilled",
  "rewardStatus": "consumed",
  "createdAt": "2026-10-22T18:00:00Z",
  "expiresAt": "2026-10-23T18:00:00Z",
  "fulfillment": "generated",
  "pairId": "3f6c1a52-8d4e-4b7a-9c21-6e0f5d2a7b13",
  "generationId": "9b2e7c41-5a3d-4f86-b1e0-2c7d9a4f6e58",
  "status": "processing",
  "result": null,
  "pollAfterSeconds": 3
}
